Hierarchy,Id,Term,ChangeType,DefinitionStatus
Procedure (procedure),5541000087103,Computed tomography of bilateral ankles with contrast (procedure),Description change,Primitive
Procedure (procedure),5551000087100,Computed tomography of left ankle with contrast (procedure),Description change,Primitive
Procedure (procedure),5611000087100,Computed tomography consultation (procedure),Description change,Primitive
Procedure (procedure),5671000087107,Magnetic resonance imaging consultation (procedure),Description change,Primitive
Procedure (procedure),6101000087104,Magnetic resonance imaging of tibia (procedure),Description change,Primitive
Procedure (procedure),6111000087102,Magnetic resonance imaging of fibula (procedure),Description change,Primitive
Procedure (procedure),6131000087107,X-ray of all fingers of left hand (procedure),Description change,Primitive
Procedure (procedure),6141000087101,X-ray of all fingers of right hand (procedure),Description change,Primitive
Procedure (procedure),6201000087105,X-ray of all toes of left foot (procedure),Description change,Primitive
Procedure (procedure),6211000087107,X-ray of all toes of right foot (procedure),Description change,Primitive
Procedure (procedure),6231000087102,Doppler ultrasonography of arteries of left lower limb (procedure),Description change,Primitive
Procedure (procedure),6241000087108,Doppler ultrasonography of arteries of right lower limb (procedure),Description change,Primitive
Procedure (procedure),6251000087106,Doppler ultrasonography of arteries of left upper limb (procedure),Description change,Primitive
Procedure (procedure),6261000087109,Doppler ultrasonography of arteries of right upper limb (procedure),Description change,Primitive
Procedure (procedure),6281000087103,Doppler ultrasonography flow mapping of veins of right lower limb (procedure),Description change,Primitive
Procedure (procedure),6291000087101,Doppler ultrasonography flow mapping of veins of left lower limb (procedure),Description change,Primitive
Procedure (procedure),6301000087102,Doppler ultrasonography flow mapping of veins of right upper limb (procedure),Description change,Primitive
Procedure (procedure),6311000087100,Doppler ultrasonography flow mapping of veins of left upper limb (procedure),Description change,Primitive
Procedure (procedure),6431000087101,Magnetic resonance imaging of left acromioclavicular joint (procedure),Description change,Primitive
Procedure (procedure),6441000087107,Magnetic resonance imaging of right acromioclavicular joint (procedure),Description change,Primitive
Procedure (procedure),6601000087107,Computed tomography of bilateral tibia and bilateral fibula with contrast (procedure),Description change,Primitive
Procedure (procedure),6611000087109,Computed tomography of bilateral tibia and bilateral fibula (procedure),Description change,Primitive
Procedure (procedure),6621000087101,Computed tomography of left tibia and left fibula with contrast (procedure),Description change,Primitive
Procedure (procedure),6631000087104,Computed tomography of left tibia and left fibula (procedure),Description change,Primitive
Procedure (procedure),6641000087105,Computed tomography of right tibia and right fibula with contrast (procedure),Description change,Primitive
Procedure (procedure),6651000087108,Computed tomography of right tibia and right fibula (procedure),Description change,Primitive
Procedure (procedure),6681000087100,Magnetic resonance imaging of bilateral tibia and bilateral fibula (procedure),Description change,Primitive
Procedure (procedure),6691000087103,Magnetic resonance imaging of bilateral tibia and bilateral fibula with contrast (procedure),Description change,Primitive
Procedure (procedure),6711000087101,Magnetic resonance imaging of left tibia and left fibula (procedure),Description change,Primitive
Procedure (procedure),6721000087109,Magnetic resonance imaging of left tibia and left fibula with contrast (procedure),Description change,Primitive
Procedure (procedure),6731000087106,Magnetic resonance imaging of right tibia and right fibula (procedure),Description change,Primitive
Procedure (procedure),6741000087100,Magnetic resonance imaging of right tibia and right fibula with contrast (procedure),Description change,Primitive
Procedure (procedure),6751000087102,Doppler ultrasonography of arteries of bilateral lower limbs (procedure),Description change,Primitive
Procedure (procedure),6761000087104,Doppler ultrasonography of arteries of bilateral upper limbs (procedure),Description change,Primitive
Procedure (procedure),6771000087108,Doppler ultrasonography flow mapping of veins of bilateral lower limbs (procedure),Description change,Primitive
Procedure (procedure),6781000087105,Doppler ultrasonography flow mapping of veins of bilateral upper limbs (procedure),Description change,Primitive
Procedure (procedure),6801000087106,Magnetic resonance imaging of bilateral acromioclavicular joints (procedure),Description change,Primitive
Procedure (procedure),6811000087108,Computed tomography and biopsy of left lower limb (procedure),Description change,Primitive
Procedure (procedure),6821000087100,Computed tomography and biopsy of right lower limb (procedure),Description change,Primitive
Procedure (procedure),9441000087104,Computed tomography of head and spine with contrast (procedure),Description change,Sufficiently defined
Procedure (procedure),9471000087107,Computed tomography of head and spine (procedure),Description change,Primitive
Procedure (procedure),9481000087109,Computed tomography angiography of chest&#44; abdominal and pelvic arteries (procedure),Description change,Primitive
Procedure (procedure),9501000087103,Computed tomography angiography of chest and abdominal arteries (procedure),Description change,Primitive
Procedure (procedure),9521000087109,Computed tomography angiography of abdominal and pelvic arteries (procedure),Description change,Primitive
Procedure (procedure),9551000087102,Magnetic resonance angiography of aorta and iliac artery (procedure),Description change,Primitive
Procedure (procedure),9561000087104,Magnetic resonance angiography of aorta artery and iliac artery with contrast (procedure),Description change,Primitive
Procedure (procedure),9701000087108,X-ray of left wrist and left scaphoid (procedure),Description change,Primitive
Procedure (procedure),9711000087105,X-ray of right wrist and right scaphoid (procedure),Description change,Primitive
Procedure (procedure),9721000087102,X-ray of left chest and left ribs (procedure),Description change,Primitive
Procedure (procedure),9731000087100,X-ray of right chest and right ribs (procedure),Description change,Primitive
Procedure (procedure),9741000087106,X-ray of bilateral wrists and bilateral scaphoids (procedure),Description change,Primitive
Procedure (procedure),9761000087107,X-ray of bilateral chest and bilateral ribs (procedure),Description change,Primitive
Procedure (procedure),9951000087106,Sentinel lymph node dissection and axillary lymph node dissection (procedure),Description change,Primitive
Procedure (procedure),10361000087104,Computed tomography of head and cervical spine (procedure),Description change,Primitive
Procedure (procedure),10381000087105,X-ray of left knee and left lower limb for bone length measurement (procedure),Description change,Primitive
Procedure (procedure),10411000087107,X-ray of right knee and right lower limb for bone length measurement (procedure),Description change,Primitive
Procedure (procedure),10421000087104,X-ray of bilateral knees and bilateral lower limbs for bone length measurement (procedure),Description change,Primitive
Procedure (procedure),10471000087100,X-ray of knee and lower limb for bone length measurement (procedure),Description change,Primitive
Procedure (procedure),10501000087109,Computed tomography of sinuses and thorax (procedure),Description change,Primitive
Procedure (procedure),10511000087106,Computed tomography of head and lumbar spine (procedure),Description change,Primitive
Procedure (procedure),10541000087107,Left diaphragm excision (procedure),Description change,Primitive
Procedure (procedure),10591000087100,Right diaphragm excision (procedure),Description change,Primitive
Procedure (procedure),11231000087108,Bilateral central compartment neck dissection (procedure),Description change,Primitive
Procedure (procedure),11341000087106,Computed tomography of right acromioclavicular joint (procedure),Description change,Primitive
Procedure (procedure),11361000087107,Magnetic resonance imaging of right lower extremity joint (procedure),Description change,Primitive
Procedure (procedure),11381000087101,Magnetic resonance imaging of left lower extremity joint (procedure),Description change,Primitive
Procedure (procedure),11411000087104,Magnetic resonance imaging of left upper extremity joint (procedure),Description change,Primitive
Procedure (procedure),11421000087107,Magnetic resonance imaging of pelvis and left hip (procedure),Description change,Primitive
Procedure (procedure),11441000087103,Computed tomography of left acromioclavicular joint (procedure),Description change,Primitive
Procedure (procedure),11541000087104,Magnetic resonance imaging of pelvis and right hip (procedure),Description change,Primitive
Procedure (procedure),11601000087103,Magnetic resonance imaging of right upper extremity joint (procedure),Description change,Primitive
Procedure (procedure),11621000087109,Magnetic resonance imaging of bilateral upper extremity joints (procedure),Description change,Primitive
Procedure (procedure),11641000087100,Magnetic resonance imaging of bilateral lower extremity joints (procedure),Description change,Primitive
Procedure (procedure),11661000087104,Computed tomography of bilateral acromioclavicular joints (procedure),Description change,Primitive
Procedure (procedure),11821000087105,X-ray of right shoulder and right acromioclavicular joint (procedure),Description change,Primitive
Procedure (procedure),11831000087107,Computed tomography of chest&#44; abdomen&#44; pelvis and lumbar spine (procedure),Description change,Primitive
Procedure (procedure),11851000087103,Computed tomography of chest and thoracic spine with contrast (procedure),Description change,Primitive
Procedure (procedure),11881000087106,Computed tomography of chest&#44; abdomen and thoracic spine (procedure),Description change,Primitive
Procedure (procedure),11891000087108,Computed tomography of chest&#44; abdomen and thoracic spine with contrast (procedure),Description change,Primitive
Procedure (procedure),11941000087107,Computed tomography of abdomen&#44; pelvis and spine (procedure),Description change,Sufficiently defined
Procedure (procedure),11951000087105,Magnetic resonance imaging of heart and abdomen (procedure),Description change,Primitive
Procedure (procedure),11971000087104,X-ray of thorax&#44; pelvis and bilateral hips (procedure),Description change,Primitive
Procedure (procedure),12001000087102,Computed tomography of chest&#44; abdomen&#44; pelvis&#44; thoracic spine and lumbar spine with contrast (procedure),Description change,Primitive
Procedure (procedure),12021000087108,Computed tomography arthrography of left upper limb (procedure),Description change,Primitive
Procedure (procedure),12051000087101,Magnetic resonance imaging of thoracic spine and sacral spine with contrast (procedure),Description change,Primitive
Procedure (procedure),12081000087109,Injection of right upper limb using ultrasonographic guidance (procedure),Description change,Primitive
Procedure (procedure),12091000087106,Computed tomography of chest and spine (procedure),Description change,Primitive
Procedure (procedure),12111000087104,Fluoroscopic angiography of abdominal vascular structure and pelvis (procedure),Description change,Primitive
Procedure (procedure),12121000087107,Computed tomography of neck and cervical spine (procedure),Description change,Primitive
Procedure (procedure),12141000087103,Computed tomography angiography of neck and thorax (procedure),Description change,Primitive
Procedure (procedure),12161000087102,Computed tomography of chest&#44; abdomen&#44; pelvis and lumbar spine with contrast (procedure),Description change,Primitive
Procedure (procedure),12181000087108,Computed tomography arthrography of right upper limb (procedure),Description change,Primitive
Procedure (procedure),12211000087109,Fluoroscopic angiography of aorta and spinal artery (procedure),Description change,Primitive
Procedure (procedure),12241000087105,Fluoroscopic angiography of aorta and lower limb (procedure),Description change,Primitive
Procedure (procedure),12261000087106,Computed tomography of neck and cervical spine with contrast (procedure),Description change,Primitive
Procedure (procedure),12281000087100,Computed tomography of chest and pelvis with contrast (procedure),Description change,Sufficiently defined
Procedure (procedure),12291000087103,Computed tomography of chest and spine with contrast (procedure),Description change,Primitive
Procedure (procedure),12301000087104,Magnetic resonance imaging of thoracic spine and sacral spine (procedure),Description change,Primitive
Procedure (procedure),12311000087102,Magnetic resonance imaging of pelvis and bilateral hips (procedure),Description change,Primitive
Procedure (procedure),12331000087107,Computed tomography of head&#44; neck and spine (procedure),Description change,Primitive
Procedure (procedure),12381000087106,Computed tomography of chest and thoracic spine (procedure),Description change,Primitive
Procedure (procedure),12391000087108,Computed tomography of head&#44; facial bones and spine (procedure),Description change,Primitive
Procedure (procedure),12441000087109,Fluoroscopic angiography of aortic arch&#44; subclavian artery and brachial artery (procedure),Description change,Primitive
Procedure (procedure),12451000087107,Computed tomography of chest&#44; abdomen&#44; pelvis&#44; lumbar spine and thoracic spine (procedure),Description change,Primitive
Procedure (procedure),12501000087105,Computed tomography of abdomen and lumbar spine (procedure),Description change,Primitive
Procedure (procedure),12521000087104,Computed tomography of neck and spine (procedure),Description change,Primitive
Procedure (procedure),12561000087109,Computed tomography of abdomen&#44; pelvis and spine with contrast (procedure),Description change,Primitive
Procedure (procedure),12581000087103,X-ray of left shoulder and left acromioclavicular joint (procedure),Description change,Primitive
Procedure (procedure),12591000087101,Computed tomography of head and thoracic spine (procedure),Description change,Primitive
Procedure (procedure),12641000087107,Ultrasonography of right breast and right axilla (procedure),Description change,Primitive
Procedure (procedure),12681000087102,Computed tomography arthrography of bilateral upper limb (procedure),Description change,Primitive
Procedure (procedure),12711000087103,Ultrasonography of bilateral breasts and bilateral axillae (procedure),Description change,Primitive
Procedure (procedure),12751000087104,X-ray of bilateral shoulders and bilateral acromioclavicular joints (procedure),Description change,Primitive
Procedure (procedure),12771000087105,Ultrasonography of left breast and left axilla (procedure),Description change,Primitive
Procedure (procedure),12931000087106,Magnetic resonance imaging of left clavicle (procedure),Description change,Primitive
Procedure (procedure),12941000087100,Magnetic resonance imaging of right clavicle (procedure),Description change,Primitive
Procedure (procedure),13051000087107,Doppler ultrasonography of aorta&#44; iliac artery and lower limb arteries (procedure),Description change,Primitive
Procedure (procedure),13481000087109,Ultrasonography of upper limb and wrist brachial pressure index using ultrasonographic guidance (procedure),Description change,Primitive
Procedure (procedure),13541000087100,X-ray of cervical spine and lumbar spine (procedure),Description change,Primitive
Procedure (procedure),13581000087105,X-ray of thoracic spine and cervical spine (procedure),Description change,Primitive
Procedure (procedure),13921000087104,Ultrasonography of abdomen&#44; pelvis and lower limb (procedure),Description change,Primitive
Procedure (procedure),13931000087102,Ultrasonography of breast and upper limb (procedure),Description change,Primitive
Procedure (procedure),14161000087108,Magnetic resonance imaging of bilateral clavicles (procedure),Description change,Primitive
Procedure (procedure),14171000087104,Ultrasonography of abdomen&#44; pelvis and left lower limb (procedure),Description change,Primitive
Procedure (procedure),14181000087102,Ultrasonography of abdomen&#44; pelvis and right lower limb (procedure),Description change,Primitive
Procedure (procedure),14201000087103,Ultrasonography of breast and left upper limb (procedure),Description change,Primitive
Procedure (procedure),14211000087101,Ultrasonography of breast and right upper limb (procedure),Description change,Primitive
Procedure (procedure),14221000087109,Ultrasonography of left groin and left scrotum (procedure),Description change,Primitive
Procedure (procedure),14231000087106,Ultrasonography of right groin and right scrotum (procedure),Description change,Primitive
Procedure (procedure),14331000087103,Doppler ultrasonography of right lower limb vessels (procedure),Description change,Primitive
Procedure (procedure),14341000087109,Ultrasonography of pelvis and left lower limb (procedure),Description change,Primitive
Procedure (procedure),14351000087107,Ultrasonography of pelvis and right lower limb (procedure),Description change,Primitive
Procedure (procedure),14601000087101,Ultrasonography of abdomen&#44; pelvis and bilateral lower limbs (procedure),Description change,Primitive
Procedure (procedure),14631000087109,Ultrasonography of breast and bilateral upper limbs (procedure),Description change,Primitive
Procedure (procedure),14651000087100,Ultrasonography of bilateral groins and bilateral scrotum (procedure),Description change,Primitive
Procedure (procedure),14661000087102,Doppler ultrasonography of arteries of bilateral lower limbs and bilateral ankle brachial pressure indexes (procedure),Description change,Primitive
Procedure (procedure),14701000087105,Ultrasonography of pelvis and bilateral lower limbs (procedure),Description change,Primitive
Procedure (procedure),14731000087102,Doppler ultrasonography of left subclavian artery (procedure),Description change,Primitive
Procedure (procedure),14741000087108,Doppler ultrasonography of right subclavian artery (procedure),Description change,Primitive
Procedure (procedure),14761000087109,Doppler ultrasonography of right subclavian vein (procedure),Description change,Primitive
Procedure (procedure),14791000087101,Doppler ultrasonography of arteries of bilateral upper limbs and bilateral ankle brachial pressure indexes (procedure),Description change,Primitive
Procedure (procedure),14851000087101,Computed tomography of chest&#44; abdomen&#44; pelvis and thoracic spine (procedure),Description change,Primitive
Procedure (procedure),14871000087107,Computed tomography angiography of abdomen&#44; pelvis and lumbar spine (procedure),Description change,Primitive
Procedure (procedure),14911000087109,Computed tomography angiography of chest and thoracic spine (procedure),Description change,Primitive
Procedure (procedure),14921000087101,Computed tomography angiography of abdomen&#44; pelvis&#44; lumbar spine and extremity (procedure),Description change,Primitive
Procedure (procedure),14931000087104,Computed tomography angiography of abdomen&#44; pelvis&#44; thoracic spine and lumbar spine (procedure),Description change,Primitive
Procedure (procedure),14941000087105,Computed tomography of head&#44; spine&#44; abdomen&#44; pelvis with contrast (procedure),Description change,Primitive
Procedure (procedure),14951000087108,Computed tomography of head&#44; neck&#44; abdomen and pelvis with contrast (procedure),Description change,Sufficiently defined
Procedure (procedure),14981000087100,Computed tomography of head&#44; facial bones&#44; neck and spine (procedure),Description change,Primitive
Procedure (procedure),15031000087104,Computed tomography of head&#44; spine&#44; chest&#44; abdomen and pelvis with contrast (procedure),Description change,Primitive
Procedure (procedure),15061000087106,Computed tomography angiography of thoracic spine&#44; abdomen and pelvis (procedure),Description change,Primitive
Procedure (procedure),15101000087108,Computed tomography of head&#44; facial bones and cervical spine (procedure),Description change,Primitive
Procedure (procedure),15131000087100,Computed tomography of facial bones and cervical spine (procedure),Description change,Primitive
Procedure (procedure),15141000087106,Computed tomography of head&#44; facial bones and cervical spine with contrast (procedure),Description change,Primitive
Procedure (procedure),15181000087101,Computed tomography of neck&#44; abdomen and pelvis with contrast (procedure),Description change,Sufficiently defined
Procedure (procedure),15221000087108,Computed tomography of pelvis and right hip (procedure),Description change,Primitive
Procedure (procedure),15231000087105,Computed tomography of pelvis and left hip (procedure),Description change,Primitive
Procedure (procedure),15241000087104,Computed tomography of right rib (procedure),Description change,Primitive
Procedure (procedure),15251000087101,Computed tomography of left rib (procedure),Description change,Primitive
Procedure (procedure),15261000087103,Computed tomography of bilateral ribs (procedure),Description change,Primitive
Procedure (procedure),15291000087106,Computed tomography of chest&#44; abdomen&#44; pelvis and thoracic spine with contrast (procedure),Description change,Primitive
Procedure (procedure),15301000087105,Computed tomography of right scaphoid (procedure),Description change,Primitive
Procedure (procedure),15311000087107,Computed tomography of left scaphoid (procedure),Description change,Primitive
Procedure (procedure),15321000087104,Computed tomography of pelvis and bilateral hips (procedure),Description change,Primitive
Procedure (procedure),15331000087102,Computed tomography of bilateral ribs with contrast (procedure),Description change,Primitive
Procedure (procedure),15341000087108,Computed tomography of bilateral scaphoids (procedure),Description change,Primitive
Procedure (procedure),15351000087106,Computed tomography of pelvis and bilateral hips with contrast (procedure),Description change,Primitive
Procedure (procedure),15361000087109,Computed tomography of bilateral scaphoids with contrast (procedure),Description change,Primitive
Procedure (procedure),15381000087103,Doppler ultrasonography of aorta&#44; iliac artery and limb arteries (procedure),Description change,Primitive
Procedure (procedure),15421000087109,Computed tomography angiography of gastrointestinal region (procedure),Description change,Primitive
Procedure (procedure),15641000087102,Ultrasonography of abdomen and limb (procedure),Description change,Primitive
Procedure (procedure),15651000087104,Ultrasonography of abdomen with doppler ultrasonography of artery of lower limb and ankle brachial pressure index (procedure),Description change,Primitive
Procedure (procedure),15661000087101,Ultrasonography of abdomen and doppler ultrasonography of vein of lower limb (procedure),Description change,Primitive
Procedure (procedure),15681000087107,Ultrasonography of breast and limb (procedure),Description change,Primitive
Procedure (procedure),15711000087106,Ultrasonography of knee and doppler ultrasonography of vein of lower limb (procedure),Description change,Primitive
Procedure (procedure),15771000087104,Fluoroscopic angiography of abdomen and femoral arteries (procedure),Description change,Primitive
Procedure (procedure),15791000087100,Fluoroscopic angiography of aorta and extremity (procedure),Description change,Primitive
Procedure (procedure),15801000087101,Fluoroscopic angiography of abdomen and aortic arch (procedure),Description change,Primitive
Procedure (procedure),15811000087104,Fluoroscopic angiography of brachial artery and abdomen arteries (procedure),Description change,Primitive
Procedure (procedure),15821000087107,Fluoroscopic angiography of aortic arch and brachial artery (procedure),Description change,Primitive
Procedure (procedure),15901000087106,Fluoroscopic angiography of left subclavian artery (procedure),Description change,Primitive
Procedure (procedure),15911000087108,Fluoroscopic angiography of right subclavian artery (procedure),Description change,Primitive
Procedure (procedure),15921000087100,Fluoroscopic angiography of aortic arch and thoracic aorta (procedure),Description change,Primitive
Procedure (procedure),15941000087109,Ultrasonography of abdomen&#44; pelvis and doppler ultrasonography of veins of lower limb (procedure),Description change,Primitive
Procedure (procedure),16021000087109,Fluoroscopic angiography of cervical vertebral arteries (procedure),Description change,Primitive
Procedure (procedure),16041000087100,Fluoroscopic angiography of left cervical vertebral arteries (procedure),Description change,Primitive
Procedure (procedure),16051000087102,Fluoroscopic angiography of right cervical vertebral arteries (procedure),Description change,Primitive
Procedure (procedure),16141000087104,Ultrasonography of pelvis and intracavitary ultrasonography (procedure),Description change,Primitive
Procedure (procedure),16151000087101,Fluoroscopic angiography of aortic arch&#44; abdomen and femoral arteries (procedure),Description change,Primitive
