Hierarchy,Id,Term,ChangeType,DefinitionStatus
Procedure (procedure),3841000087104,X-ray of left scaphoid (procedure),Inferred view change,Primitive
Procedure (procedure),3851000087101,X-ray of right scaphoid (procedure),Inferred view change,Primitive
Procedure (procedure),3971000087102,X-ray of bilateral calcanei (procedure),Inferred view change,Primitive
Procedure (procedure),3981000087100,X-ray of bilateral clavicles (procedure),Inferred view change,Primitive
Procedure (procedure),4001000087105,X-ray of bilateral femurs (procedure),Inferred view change,Primitive
Procedure (procedure),4071000087100,X-ray of bilateral patellae (procedure),Inferred view change,Primitive
Procedure (procedure),4091000087101,X-ray of bilateral scaphoids (procedure),Inferred view change,Primitive
Procedure (procedure),4631000087106,Angiography of left brachial artery (procedure),Inferred view change,Primitive
Procedure (procedure),4641000087100,Angiography of right brachial artery (procedure),Inferred view change,Primitive
Procedure (procedure),5191000087101,Angiography of bilateral brachial arteries (procedure),Inferred view change,Primitive
Procedure (procedure),5481000087107,Needle localization of left breast using ultrasonographic guidance (procedure),Inferred view change,Primitive
Procedure (procedure),5491000087109,Needle localization of right breast using ultrasonographic guidance (procedure),Inferred view change,Primitive
Procedure (procedure),5571000087106,Needle localization of bilateral breasts using ultrasonographic guidance (procedure),Inferred view change,Primitive
Procedure (procedure),5611000087100,Computed tomography consultation (procedure),Inferred view change,Primitive
Procedure (procedure),5621000087108,Mammography consultation (procedure),Inferred view change,Primitive
Procedure (procedure),5631000087105,Nuclear medicine consultation (procedure),Inferred view change,Primitive
Procedure (procedure),5641000087104,Positron emission tomography consultation (procedure),Inferred view change,Primitive
Procedure (procedure),5651000087101,Fluoroscopy consultation (procedure),Inferred view change,Primitive
Procedure (procedure),5661000087103,Angiography consultation (procedure),Inferred view change,Primitive
Procedure (procedure),5671000087107,Magnetic resonance imaging consultation (procedure),Inferred view change,Primitive
Procedure (procedure),5681000087109,Ultrasonography consultation (procedure),Inferred view change,Primitive
Procedure (procedure),5691000087106,Bone density scan consultation (procedure),Inferred view change,Primitive
Procedure (procedure),5831000087106,Cecostomy tube procedure using fluoroscopic guidance (procedure),Inferred view change,Primitive
Procedure (procedure),6201000087105,X-ray of all toes of left foot (procedure),Inferred view change,Primitive
Procedure (procedure),6211000087107,X-ray of all toes of right foot (procedure),Inferred view change,Primitive
Procedure (procedure),6681000087100,Magnetic resonance imaging of bilateral tibia and bilateral fibula (procedure),Inferred view change,Primitive
Procedure (procedure),6691000087103,Magnetic resonance imaging of bilateral tibia and bilateral fibula with contrast (procedure),Inferred view change,Primitive
Procedure (procedure),6711000087101,Magnetic resonance imaging of left tibia and left fibula (procedure),Inferred view change,Primitive
Procedure (procedure),6721000087109,Magnetic resonance imaging of left tibia and left fibula with contrast (procedure),Inferred view change,Primitive
Procedure (procedure),6731000087106,Magnetic resonance imaging of right tibia and right fibula (procedure),Inferred view change,Primitive
Procedure (procedure),6741000087100,Magnetic resonance imaging of right tibia and right fibula with contrast (procedure),Inferred view change,Primitive
Procedure (procedure),8991000087106,Doppler ultrasonography of inguinal region (procedure),Inferred view change,Primitive
Procedure (procedure),9101000087107,Doppler ultrasonography of left iliac vessels (procedure),Inferred view change,Primitive
Procedure (procedure),9111000087109,Doppler ultrasonography of arteries of right inguinal region (procedure),Inferred view change,Primitive
Procedure (procedure),9121000087101,Doppler ultrasonography of arteries of left inguinal region (procedure),Inferred view change,Primitive
Procedure (procedure),9151000087108,Doppler ultrasonography of right iliac vessels (procedure),Inferred view change,Primitive
Procedure (procedure),9161000087106,Doppler ultrasonography of arteries of bilateral inguinal regions (procedure),Inferred view change,Primitive
Procedure (procedure),9181000087100,Doppler ultrasonography of bilateral iliac vessels (procedure),Inferred view change,Primitive
Procedure (procedure),9441000087104,Computed tomography of head and spine with contrast (procedure),Inferred view change,Sufficiently defined
Procedure (procedure),9481000087109,Computed tomography angiography of chest&#44; abdominal and pelvic arteries (procedure),Inferred view change,Primitive
Procedure (procedure),9611000087102,X-ray of wrist and scaphoid (procedure),Inferred view change,Primitive
Procedure (procedure),9701000087108,X-ray of left wrist and left scaphoid (procedure),Inferred view change,Primitive
Procedure (procedure),9711000087105,X-ray of right wrist and right scaphoid (procedure),Inferred view change,Primitive
Procedure (procedure),9741000087106,X-ray of bilateral wrists and bilateral scaphoids (procedure),Inferred view change,Primitive
Procedure (procedure),10381000087105,X-ray of left knee and left lower limb for bone length measurement (procedure),Inferred view change,Primitive
Procedure (procedure),10411000087107,X-ray of right knee and right lower limb for bone length measurement (procedure),Inferred view change,Primitive
Procedure (procedure),10421000087104,X-ray of bilateral knees and bilateral lower limbs for bone length measurement (procedure),Inferred view change,Primitive
Procedure (procedure),10471000087100,X-ray of knee and lower limb for bone length measurement (procedure),Inferred view change,Primitive
Procedure (procedure),10521000087103,X-ray of pelvis and sacroiliac joints (procedure),Inferred view change,Primitive
Procedure (procedure),11171000087101,Right diaphragm stripping (procedure),Inferred view change,Primitive
Procedure (procedure),11181000087104,Left diaphragm stripping (procedure),Inferred view change,Primitive
Procedure (procedure),11231000087108,Bilateral central compartment neck dissection (procedure),Inferred view change,Primitive
Procedure (procedure),11261000087101,Unilateral central compartment lymph nodes neck dissection (procedure),Inferred view change,Primitive
Procedure (procedure),11451000087100,Magnetic resonance angiography of femoral vessels with contrast (procedure),Inferred view change,Primitive
Procedure (procedure),11511000087100,Injection of right lower limb using ultrasonographic guidance (procedure),Inferred view change,Primitive
Procedure (procedure),11711000087109,Magnetic resonance angiography of femoral vessels (procedure),Inferred view change,Primitive
Procedure (procedure),11831000087107,Computed tomography of chest&#44; abdomen&#44; pelvis and lumbar spine (procedure),Inferred view change,Primitive
Procedure (procedure),11981000087102,Computed tomography arthrography of right lower limb (procedure),Inferred view change,Primitive
Procedure (procedure),12001000087102,Computed tomography of chest&#44; abdomen&#44; pelvis&#44; thoracic spine and lumbar spine with contrast (procedure),Inferred view change,Primitive
Procedure (procedure),12021000087108,Computed tomography arthrography of left upper limb (procedure),Inferred view change,Primitive
Procedure (procedure),12051000087101,Magnetic resonance imaging of thoracic spine and sacral spine with contrast (procedure),Inferred view change,Primitive
Procedure (procedure),12081000087109,Injection of right upper limb using ultrasonographic guidance (procedure),Inferred view change,Primitive
Procedure (procedure),12161000087102,Computed tomography of chest&#44; abdomen&#44; pelvis and lumbar spine with contrast (procedure),Inferred view change,Primitive
Procedure (procedure),12181000087108,Computed tomography arthrography of right upper limb (procedure),Inferred view change,Primitive
Procedure (procedure),12441000087109,Fluoroscopic angiography of aortic arch&#44; subclavian artery and brachial artery (procedure),Inferred view change,Primitive
Procedure (procedure),12451000087107,Computed tomography of chest&#44; abdomen&#44; pelvis&#44; lumbar spine and thoracic spine (procedure),Inferred view change,Primitive
Procedure (procedure),12471000087101,Injection of left upper limb using ultrasonographic guidance (procedure),Inferred view change,Primitive
Procedure (procedure),12491000087102,Computed tomography angiography of thorax&#44; pelvis and lower limb (procedure),Inferred view change,Primitive
Procedure (procedure),12511000087107,Computed tomography arthrography of left lower limb (procedure),Inferred view change,Primitive
Procedure (procedure),12681000087102,Computed tomography arthrography of bilateral upper limb (procedure),Inferred view change,Primitive
Procedure (procedure),12691000087100,Injection of bilateral lower limbs using ultrasonographic guidance (procedure),Inferred view change,Primitive
Procedure (procedure),12701000087100,Computed tomography arthrography of bilateral lower limbs (procedure),Inferred view change,Primitive
Procedure (procedure),12731000087108,Injection of left lower limb using ultrasonographic guidance (procedure),Inferred view change,Primitive
Procedure (procedure),12741000087102,Injection of bilateral upper limbs using ultrasonographic guidance (procedure),Inferred view change,Primitive
Procedure (procedure),12981000087105,Ultrasonography of abdomen and doppler ultrasonography of transplanted kidney (procedure),Inferred view change,Primitive
Procedure (procedure),12991000087107,Ultrasonography of abdomen&#44; inguinal region and scrotum (procedure),Inferred view change,Primitive
Procedure (procedure),13041000087109,Doppler ultrasonography of aorta and femoral artery (procedure),Inferred view change,Primitive
Procedure (procedure),13051000087107,Doppler ultrasonography of aorta&#44; iliac artery and lower limb arteries (procedure),Inferred view change,Primitive
Procedure (procedure),13081000087104,Biopsy of bilateral axillae using ultrasonographic guidance (procedure),Inferred view change,Primitive
Procedure (procedure),13091000087102,Ultrasonography of bladder and doppler ultrasonography of transplanted kidney (procedure),Inferred view change,Primitive
Procedure (procedure),13221000087107,Ultrasonography of groin and scrotum (procedure),Inferred view change,Primitive
Procedure (procedure),13231000087109,Doppler ultrasonography of left groin vessels (procedure),Inferred view change,Primitive
Procedure (procedure),13241000087103,Doppler ultrasonography of right groin vessels (procedure),Inferred view change,Primitive
Procedure (procedure),13271000087106,Doppler ultrasonography of left iliac artery (procedure),Inferred view change,Primitive
Procedure (procedure),13281000087108,Doppler ultrasonography of right iliac artery (procedure),Inferred view change,Primitive
Procedure (procedure),13291000087105,Doppler ultrasonography of inferior vena cava and iliac vein (procedure),Inferred view change,Primitive
Procedure (procedure),13351000087105,Doppler ultrasonography of left lower limb vessels and ankle brachial pressure index (procedure),Inferred view change,Primitive
Procedure (procedure),13421000087108,Ultrasonography of pelvis&#44; groin and scrotum (procedure),Inferred view change,Primitive
Procedure (procedure),13481000087109,Ultrasonography of upper limb and wrist brachial pressure index using ultrasonographic guidance (procedure),Inferred view change,Primitive
Procedure (procedure),13541000087100,X-ray of cervical spine and lumbar spine (procedure),Inferred view change,Primitive
Procedure (procedure),13551000087102,X-ray of cervical spine and pelvis (procedure),Inferred view change,Primitive
Procedure (procedure),13561000087104,X-ray of cervical spine and shoulder (procedure),Inferred view change,Primitive
Procedure (procedure),13581000087105,X-ray of thoracic spine and cervical spine (procedure),Inferred view change,Primitive
Procedure (procedure),13621000087105,X-ray of facial bones and mandible (procedure),Inferred view change,Primitive
Procedure (procedure),13631000087107,X-ray of facial bones and nasal bones (procedure),Inferred view change,Primitive
Procedure (procedure),13641000087101,X-ray of facial bones and orbits (procedure),Inferred view change,Primitive
Procedure (procedure),13661000087100,X-ray of lumbar spine and hip (procedure),Inferred view change,Primitive
Procedure (procedure),13671000087109,X-ray of lumbar spine and bilateral hips (procedure),Inferred view change,Primitive
Procedure (procedure),13681000087106,X-ray of lumbar spine&#44; sacroiliac joints and pelvis (procedure),Inferred view change,Primitive
Procedure (procedure),13691000087108,X-ray of lumbar spine&#44; sacroiliac joints&#44; pelvis and hip (procedure),Inferred view change,Primitive
Procedure (procedure),13701000087108,X-ray of lumbar spine&#44; sacroiliac joints&#44; pelvis and bilateral hips (procedure),Inferred view change,Primitive
Procedure (procedure),13711000087105,X-ray of mandible and temporomandibular joints (procedure),Inferred view change,Primitive
Procedure (procedure),13721000087102,X-ray of pelvis and bilateral femurs (procedure),Inferred view change,Primitive
Procedure (procedure),13741000087106,X-ray of sacrum and sacroiliac joints (procedure),Inferred view change,Primitive
Procedure (procedure),13771000087103,X-ray of skull and cervical spine (procedure),Inferred view change,Primitive
Procedure (procedure),13781000087101,X-ray of skull&#44; chest and abdomen (procedure),Inferred view change,Primitive
Procedure (procedure),13791000087104,X-ray of skull and facial bones (procedure),Inferred view change,Primitive
Procedure (procedure),13921000087104,Ultrasonography of abdomen&#44; pelvis and lower limb (procedure),Inferred view change,Primitive
Procedure (procedure),13951000087106,Doppler ultrasonography of pelvis and veins of lower limb (procedure),Inferred view change,Primitive
Procedure (procedure),13991000087101,Doppler ultrasonography of right lower limb vessels and ankle brachial pressure index (procedure),Inferred view change,Primitive
Procedure (procedure),14221000087109,Ultrasonography of left groin and left scrotum (procedure),Inferred view change,Primitive
Procedure (procedure),14231000087106,Ultrasonography of right groin and right scrotum (procedure),Inferred view change,Primitive
Procedure (procedure),14241000087100,Doppler ultrasonography of bilateral iliac arteries (procedure),Inferred view change,Primitive
Procedure (procedure),14271000087108,Biopsy of left lower limb using ultrasonographic guidance (procedure),Inferred view change,Primitive
Procedure (procedure),14281000087105,Biopsy of right lower limb using ultrasonographic guidance (procedure),Inferred view change,Primitive
Procedure (procedure),14311000087108,Doppler ultrasonography of bilateral lower limb vessels and ankle brachial pressure index (procedure),Inferred view change,Primitive
Procedure (procedure),14321000087100,Doppler ultrasonography of left lower limb vessels (procedure),Inferred view change,Primitive
Procedure (procedure),14331000087103,Doppler ultrasonography of right lower limb vessels (procedure),Inferred view change,Primitive
Procedure (procedure),14341000087109,Ultrasonography of pelvis and left lower limb (procedure),Inferred view change,Primitive
Procedure (procedure),14351000087107,Ultrasonography of pelvis and right lower limb (procedure),Inferred view change,Primitive
Procedure (procedure),14371000087101,Injection of left sacroiliac joint using ultrasonographic guidance (procedure),Inferred view change,Primitive
Procedure (procedure),14381000087104,Injection of right sacroiliac joint using ultrasonographic guidance (procedure),Inferred view change,Primitive
Procedure (procedure),14411000087102,Biopsy of left upper limb using ultrasonographic guidance (procedure),Inferred view change,Primitive
Procedure (procedure),14421000087105,Biopsy of right upper limb using ultrasonographic guidance (procedure),Inferred view change,Primitive
Procedure (procedure),14431000087107,Drainage of left upper limb using ultrasonographic guidance (procedure),Inferred view change,Primitive
Procedure (procedure),14441000087101,Drainage of right upper limb using ultrasonographic guidance (procedure),Inferred view change,Primitive
Procedure (procedure),14451000087103,Doppler ultrasonography of left upper limb vessels (procedure),Inferred view change,Primitive
Procedure (procedure),14461000087100,Doppler ultrasonography of right upper limb vessels (procedure),Inferred view change,Primitive
Procedure (procedure),14511000087103,Doppler ultrasonography of right femoral artery (procedure),Inferred view change,Primitive
Procedure (procedure),14521000087106,Doppler ultrasonography of left femoral artery (procedure),Inferred view change,Primitive
Procedure (procedure),14551000087104,Doppler ultrasonography of aorta and right femoral artery (procedure),Inferred view change,Primitive
Procedure (procedure),14561000087101,Doppler ultrasonography of aorta and left femoral artery (procedure),Inferred view change,Primitive
Procedure (procedure),14571000087105,Doppler ultrasonography of superior vena cava and vein of upper limb (procedure),Inferred view change,Primitive
Procedure (procedure),14611000087104,Doppler ultrasonography of aorta and bilateral femoral arteries (procedure),Inferred view change,Primitive
Procedure (procedure),14621000087107,Biopsy of right axilla using ultrasonographic guidance (procedure),Inferred view change,Primitive
Procedure (procedure),14641000087103,Doppler ultrasonography of bilateral femoral arteries (procedure),Inferred view change,Primitive
Procedure (procedure),14651000087100,Ultrasonography of bilateral groins and bilateral scrotum (procedure),Inferred view change,Primitive
Procedure (procedure),14671000087106,Biopsy of bilateral lower limbs using ultrasonographic guidance (procedure),Inferred view change,Primitive
Procedure (procedure),14691000087105,Doppler ultrasonography of bilateral lower limb vessels (procedure),Inferred view change,Primitive
Procedure (procedure),14711000087107,Injection of bilateral sacroiliac joints using ultrasonographic guidance (procedure),Inferred view change,Primitive
Procedure (procedure),14721000087104,Doppler ultrasonography of bilateral subclavian arteries (procedure),Inferred view change,Primitive
Procedure (procedure),14731000087102,Doppler ultrasonography of left subclavian artery (procedure),Inferred view change,Primitive
Procedure (procedure),14741000087108,Doppler ultrasonography of right subclavian artery (procedure),Inferred view change,Primitive
Procedure (procedure),14751000087106,Doppler ultrasonography of left subclavian vein (procedure),Inferred view change,Primitive
Procedure (procedure),14761000087109,Doppler ultrasonography of right subclavian vein (procedure),Inferred view change,Primitive
Procedure (procedure),14771000087100,Doppler ultrasonography of superior vena cava and vein of left upper limb (procedure),Inferred view change,Primitive
Procedure (procedure),14781000087103,Doppler ultrasonography of superior vena cava and vein of right upper limb (procedure),Inferred view change,Primitive
Procedure (procedure),14801000087102,Biopsy of bilateral upper limbs using ultrasonographic guidance (procedure),Inferred view change,Primitive
Procedure (procedure),14811000087100,Doppler ultrasonography of bilateral upper limb vessels (procedure),Inferred view change,Primitive
Procedure (procedure),14831000087105,Doppler ultrasonography of bilateral subclavian veins (procedure),Inferred view change,Primitive
Procedure (procedure),14851000087101,Computed tomography of chest&#44; abdomen&#44; pelvis and thoracic spine (procedure),Inferred view change,Primitive
Procedure (procedure),14931000087104,Computed tomography angiography of abdomen&#44; pelvis&#44; thoracic spine and lumbar spine (procedure),Inferred view change,Primitive
Procedure (procedure),14941000087105,Computed tomography of head&#44; spine&#44; abdomen&#44; pelvis with contrast (procedure),Inferred view change,Primitive
Procedure (procedure),14951000087108,Computed tomography of head&#44; neck&#44; abdomen and pelvis with contrast (procedure),Inferred view change,Sufficiently defined
Procedure (procedure),15031000087104,Computed tomography of head&#44; spine&#44; chest&#44; abdomen and pelvis with contrast (procedure),Inferred view change,Primitive
Procedure (procedure),15061000087106,Computed tomography angiography of thoracic spine&#44; abdomen and pelvis (procedure),Inferred view change,Primitive
Procedure (procedure),15181000087101,Computed tomography of neck&#44; abdomen and pelvis with contrast (procedure),Inferred view change,Sufficiently defined
Procedure (procedure),15221000087108,Computed tomography of pelvis and right hip (procedure),Inferred view change,Primitive
Procedure (procedure),15231000087105,Computed tomography of pelvis and left hip (procedure),Inferred view change,Primitive
Procedure (procedure),15241000087104,Computed tomography of right rib (procedure),Inferred view change,Primitive
Procedure (procedure),15251000087101,Computed tomography of left rib (procedure),Inferred view change,Primitive
Procedure (procedure),15261000087103,Computed tomography of bilateral ribs (procedure),Inferred view change,Primitive
Procedure (procedure),15271000087107,Biopsy of left scapula using computed tomography guidance (procedure),Inferred view change,Primitive
Procedure (procedure),15281000087109,Biopsy of right scapula using computed tomography guidance (procedure),Inferred view change,Primitive
Procedure (procedure),15291000087106,Computed tomography of chest&#44; abdomen&#44; pelvis and thoracic spine with contrast (procedure),Inferred view change,Primitive
Procedure (procedure),15301000087105,Computed tomography of right scaphoid (procedure),Inferred view change,Primitive
Procedure (procedure),15311000087107,Computed tomography of left scaphoid (procedure),Inferred view change,Primitive
Procedure (procedure),15331000087102,Computed tomography of bilateral ribs with contrast (procedure),Inferred view change,Primitive
Procedure (procedure),15341000087108,Computed tomography of bilateral scaphoids (procedure),Inferred view change,Primitive
Procedure (procedure),15361000087109,Computed tomography of bilateral scaphoids with contrast (procedure),Inferred view change,Primitive
Procedure (procedure),15381000087103,Doppler ultrasonography of aorta&#44; iliac artery and limb arteries (procedure),Inferred view change,Primitive
Procedure (procedure),15411000087101,Computed tomography angiography of chest and limb (procedure),Inferred view change,Primitive
Procedure (procedure),15641000087102,Ultrasonography of abdomen and limb (procedure),Inferred view change,Primitive
Procedure (procedure),15681000087107,Ultrasonography of breast and limb (procedure),Inferred view change,Primitive
Procedure (procedure),15791000087100,Fluoroscopic angiography of aorta and extremity (procedure),Inferred view change,Primitive
Procedure (procedure),15801000087101,Fluoroscopic angiography of abdomen and aortic arch (procedure),Inferred view change,Primitive
Procedure (procedure),15811000087104,Fluoroscopic angiography of brachial artery and abdomen arteries (procedure),Inferred view change,Primitive
Procedure (procedure),15821000087107,Fluoroscopic angiography of aortic arch and brachial artery (procedure),Inferred view change,Primitive
Procedure (procedure),15941000087109,Ultrasonography of abdomen&#44; pelvis and doppler ultrasonography of veins of lower limb (procedure),Inferred view change,Primitive
Procedure (procedure),16061000087104,Computed tomography angiography of abdomen&#44; pelvis and limb (procedure),Inferred view change,Primitive
Procedure (procedure),16071000087108,Computed tomography angiography of pelvis and limb (procedure),Inferred view change,Primitive
Procedure (procedure),16101000087102,Fetal biophysical profile and doppler ultrasonography of fetal head (procedure),Inferred view change,Primitive
Procedure (procedure),16111000087100,Biopsy of left inguinal region using ultrasonographic guidance (procedure),Inferred view change,Primitive
Procedure (procedure),16121000087108,Biopsy of right inguinal region using ultrasonographic guidance (procedure),Inferred view change,Primitive
Procedure (procedure),16141000087104,Ultrasonography of pelvis and intracavitary ultrasonography (procedure),Inferred view change,Primitive
Procedure (procedure),16151000087101,Fluoroscopic angiography of aortic arch&#44; abdomen and femoral arteries (procedure),Inferred view change,Primitive
Procedure (procedure),16161000087103,Fluoroscopic angiography of brachial artery&#44; abdomen arteries and femoral arteries (procedure),Inferred view change,Primitive
Procedure (procedure),16171000087107,Fluoroscopic angiography of chest&#44; abdomen and femoral arteries (procedure),Inferred view change,Primitive
Procedure (procedure),16271000087103,Fluoroscopic angiography of aorta and right extremity (procedure),Inferred view change,Primitive
Procedure (procedure),16281000087101,Fluoroscopic angiography of aorta and left extremity (procedure),Inferred view change,Primitive
Procedure (procedure),16291000087104,Fluoroscopic angioplasty of abdominal aorta&#44; right iliac arteries and right femoral arteries (procedure),Inferred view change,Primitive
